,ts_code,name,industry,COL_LASTPRICE,COL_LAST_PCT_CHG,concept,circ_mv
0,300610.SZ,晨化股份,化工原料,14.26,10.0309,"高送转-预期, 石油化工, 年报季报, ",7.09亿
1,300405.SZ,科隆股份,化工原料,19.6,9.9888,"石油化工, 高送转, 股权转让, 国资入股, ",25.99亿
2,601233.SH,桐昆股份,化纤,13.41,1.2075,"MSCI, 涤纶, 高送转-预期, 供应链金融, 石油化工, ",239.28亿
3,600309.SH,万华化学,化工原料,40.19,0.2995,"白马股, 环氧丙烷, 阿里巴巴概念股, 高送转-预期, 社保重仓, 新零售, 石油化工, 煤化工, 山东国企改革, 油品升级, 共享经济, 资产重组, ",572.21亿
4,600230.SH,沧州大化,农药化肥,16.26,-1.2151,"高送转-预期, 央企改革, 石油化工, 煤化工, 京津冀, 股权转让, ",66.97亿
5,002709.SZ,天赐材料,化工原料,25.44,-2.3041,"有机硅, 业绩预增, 石油化工, 定增破发, 锂电池, 新能源汽车, 高送转, ",86.17亿
